ID,title,customerName,productName,summary,category,urgency,sentiment,messageTitleCustomerLanguage,customerId,productId,summaryCustomerLanguage,originatingCountry,sourceLanguage,fullMessageTextCustomerLanguage,fullMessageTextEnglish,suggestedResponseTextEnglish,suggestedResponseTextCustomerLanguage,a_ServiceOrder_ServiceOrder
123e4567-e89b-12d3-a456-426614174000,Problème de produit,John Doe,Produit A,,Technical,High,Negative,Problème de produit,JD001,PA001,Le produit ne fonctionne pas correctement,France,French,Le produit ne fonctionne pas correctement. Il semble y avoir un défaut.,,,Nous nous excusons pour le désagrément. Nous remplacerons le produit.,
123e4567-e89b-12d3-a456-426614174001,Problème de livraison,Jane Doe,Produit B,,Delivery,Medium,Negative,Problème de livraison,JD002,PB001,La livraison est en retard,France,French,La livraison est en retard. Je suis déçu.,,,Nous nous excusons pour le retard. Nous accélérerons la livraison.,
123e4567-e89b-12d3-a456-426614174002,Excellent produit,John Smith,Produit C,,Product,Low,Positive,Excellent produit,JS001,PC001,Je suis très satisfait du produit,France,French,Je suis très satisfait du produit. Il fonctionne parfaitement.,,,Nous sommes ravis de l'entendre. Merci pour vos commentaires.,
123e4567-e89b-12d3-a456-426614174003,Service client médiocre,Jane Smith,Produit D,,Service,High,Negative,Service client médiocre,JS002,PD001,Le service client n'a pas été utile,France,French,Le service client n'a pas été utile. Je suis déçu.,,We apologize for the inconvenience. We will improve our service.,Nous nous excusons pour le désagrément. Nous améliorerons notre service.,
123e4567-e89b-12d3-a456-426614174004,Problème de facturation,Jack London,Produit E,,Billing,Medium,Negative,Problème de facturation,JD003,PE001,Il y a une erreur dans la facturation,France,French,Il y a une erreur dans la facturation. Je suis déçu.,,We apologize for the mistake. We will correct the billing.,Nous nous excusons pour l'erreur. Nous corrigerons la facturation.,