ID,title,customerName,productName,summary,category,urgency,sentiment,messageTitleCustomerLanguage,customerId,productId,summaryCustomerLanguage,originatingCountry,sourceLanguage,fullMessageTextCustomerLanguage,fullMessageTextEnglish,suggestedResponseTextEnglish,suggestedResponseTextCustomerLanguage
123e4567-e89b-12d3-a456-426614174000,Problème de produit,John Doe,Produit A,Le produit ne fonctionne pas correctement,Technical,High,Negative,Problème de produit,JD001,PA001,Le produit ne fonctionne pas correctement,France,French,Le produit ne fonctionne pas correctement. Il semble y avoir un défaut.,The product is not working properly. There seems to be a defect.,We apologize for the inconvenience. We will replace the product.,Nous nous excusons pour le désagrément. Nous remplacerons le produit.
123e4567-e89b-12d3-a456-426614174001,Problème de livraison,Jane Doe,Produit B,La livraison est en retard,Delivery,Medium,Negative,Problème de livraison,JD002,PB001,La livraison est en retard,France,French,La livraison est en retard. Je suis déçu.,The delivery is late. I am disappointed.,We apologize for the delay. We will expedite the delivery.,Nous nous excusons pour le retard. Nous accélérerons la livraison.
123e4567-e89b-12d3-a456-426614174002,Excellent produit,John Smith,Produit C,Je suis très satisfait du produit,Product,Low,Positive,Excellent produit,JS001,PC001,Je suis très satisfait du produit,France,French,Je suis très satisfait du produit. Il fonctionne parfaitement.,I am very satisfied with the product. It works perfectly.,We are glad to hear that. Thank you for your feedback.,Nous sommes ravis de l'entendre. Merci pour vos commentaires.
123e4567-e89b-12d3-a456-426614174003,Service client médiocre,Jane Smith,Produit D,Le service client n'a pas été utile,Service,High,Negative,Service client médiocre,JS002,PD001,Le service client n'a pas été utile,France,French,Le service client n'a pas été utile. Je suis déçu.,The customer service was not helpful. I am disappointed.,We apologize for the inconvenience. We will improve our service.,Nous nous excusons pour le désagrément. Nous améliorerons notre service.
123e4567-e89b-12d3-a456-426614174004,Problème de facturation,Jack London,Produit E,Il y a une erreur dans la facturation,Billing,Medium,Negative,Problème de facturation,JD003,PE001,Il y a une erreur dans la facturation,France,French,Il y a une erreur dans la facturation. Je suis déçu.,There is an error in the billing. I am disappointed.,We apologize for the mistake. We will correct the billing.,Nous nous excusons pour l'erreur. Nous corrigerons la facturation.